{
    "id": "obj-001",
    "type": "set_plan",
    "version": "0.1",
    "revision": 0,
    "schema": "av.planning.set-plan.v0",
    "source": {
        "kind": "fixture",
        "submitted_by": "tests",
        "submission_id": "subm-001"
    },
    "provenance": {
        "plan_id": "plan-phase0",
        "compiler_run_id": "compile-001",
        "parent_ids": [
            "root"
        ]
    }
}